{
  "saee_synthetic_external_observation_v0_1": true,
  "schema_version": "0.1.0",
  "observation_id": "observation:phase2b-synthetic-adapter-001",
  "trace_id": "trace:phase2b-synthetic-adapter-001",
  "created_at": "2026-07-11T20:00:00Z",
  "adapter_id": "adapter:saee-local-synthetic-observation-v0.1",
  "runtime_ref": "runtime:phase2b-local-synthetic-001",
  "authorization_ref": "authorization:phase2b-synthetic-declared-001",
  "authorization_scope": "local synthetic observable summaries only",
  "retention_ref": "retention:phase2b-local-ephemeral",
  "deletion_ref": "deletion:phase2b-local-ephemeral",
  "events": [
    {
      "event_id": "event:phase2b-runtime-state-001",
      "sequence": 0,
      "timestamp": "2026-07-11T20:00:00Z",
      "event_type": "runtime_state",
      "observable_behavior_summary": "Synthetic runtime entered a bounded local state."
    }
  ],
  "content_boundary": {
    "observable_behavior_summary_only": true,
    "raw_prompt_present": false,
    "raw_output_present": false,
    "hidden_reasoning_present": false,
    "private_chain_of_thought_present": false,
    "internal_model_state_present": false,
    "customer_data_present": false
  }
}
